{
  "format": "gravitas.observation",
  "formatVersion": 1,
  "kind": "time-series",
  "id": "pack:tess-hd209458-s56-lc@1.0.0",
  "title": "HD 209458: TESS sector 56 light curve",
  "object": {
    "name": "HD 209458",
    "ra": 330.794887332661,
    "dec": 18.8843189579296,
    "frame": "ICRS, epoch J2000"
  },
  "facility": "TESS, camera 1, CCD 2, 2-minute cadence, SPOC spoc-5.0.96-20230729",
  "origin": "observed",
  "source": {
    "kind": "pack",
    "id": "tess-hd209458-s56-lc",
    "version": "1.0.0"
  },
  "credit": "TESS, sector 56 (NASA; SPOC light curve from MAST)",
  "license": {
    "status": "public-domain",
    "statement": "NASA mission data, released through MAST without restriction on reuse. MAST asks that work using its data acknowledge the mission and the archive."
  },
  "retrieved": "2026-09-24",
  "citations": [
    {
      "text": "TESS light curves from MAST (Ricker et al. 2015, JATIS 1, 014003)",
      "url": "https://doi.org/10.17909/t9-nmc8-f686"
    }
  ],
  "reductions": [
    "QUALITY: any nonzero flag drops the cadence (1288 dropped)",
    "TIME, PDCSAP_FLUX, PDCSAP_FLUX_ERR: a cadence without a finite value in all three is dropped (0 dropped)",
    "bin: a bin with fewer than 3 kept cadences is dropped (3 dropped)",
    "20-minute bins average 10 two-minute cadences each, which rounds ingress and egress to a bin.",
    "Flux is kept to 1 ppm and its error to 5 ppm."
  ],
  "axes": {
    "x": "time",
    "y": "flux"
  },
  "time": {
    "column": "time",
    "format": "BTJD",
    "scale": "TDB"
  },
  "columns": [
    {
      "id": "time",
      "name": "time",
      "unit": "d",
      "role": "x",
      "values": [
        2825.2708333333335,
        2825.284722222222,
        2825.2986111111113,
        2825.3125,
        2825.3263888888887,
        2825.340277777778,
        2825.3541666666665,
        2825.3680555555557,
        2825.3819444444443,
        2825.3958333333335,
        2825.409722222222,
        2825.4236111111113,
        2825.4375,
        2825.4513888888887,
        2825.465277777778,
        2825.4791666666665,
        2825.4930555555557,
        2825.5069444444443,
        2825.5208333333335,
        2825.534722222222,
        2825.5486111111113,
        2825.5625,
        2825.5763888888887,
        2825.590277777778,
        2825.6041666666665,
        2825.6180555555557,
        2825.6319444444443,
        2825.6458333333335,
        2825.659722222222,
        2825.6736111111113,
        2825.6875,
        2825.7013888888887,
        2825.715277777778,
        2825.7291666666665,
        2825.7430555555557,
        2825.7569444444443,
        2825.7708333333335,
        2825.784722222222,
        2825.7986111111113,
        2825.8125,
        2825.8263888888887,
        2825.840277777778,
        2825.8541666666665,
        2825.8680555555557,
        2825.8819444444443,
        2825.8958333333335,
        2825.909722222222,
        2825.9236111111113,
        2825.9375,
        2825.9513888888887,
        2825.965277777778,
        2825.9791666666665,
        2825.9930555555557,
        2826.0069444444443,
        2826.0208333333335,
        2826.034722222222,
        2826.0486111111113,
        2826.0625,
        2826.0763888888887,
        2826.090277777778,
        2826.1041666666665,
        2826.1180555555557,
        2826.1319444444443,
        2826.1458333333335,
        2826.159722222222,
        2826.1736111111113,
        2826.1875,
        2826.2013888888887,
        2826.215277777778,
        2826.2291666666665,
        2826.2430555555557,
        2826.2569444444443,
        2826.2708333333335,
        2826.284722222222,
        2826.2986111111113,
        2826.3125,
        2826.3263888888887,
        2826.340277777778,
        2826.3541666666665,
        2826.3680555555557,
        2826.3819444444443,
        2826.3958333333335,
        2826.409722222222,
        2826.4236111111113,
        2826.4375,
        2826.4513888888887,
        2826.465277777778,
        2826.4791666666665,
        2826.4930555555557,
        2826.5069444444443,
        2826.5208333333335,
        2826.534722222222,
        2826.5486111111113,
        2826.5625,
        2826.5763888888887,
        2826.590277777778,
        2826.6041666666665,
        2826.6180555555557,
        2826.6319444444443,
        2826.6458333333335,
        2826.659722222222,
        2826.6736111111113,
        2826.6875,
        2826.7013888888887,
        2826.715277777778,
        2826.7291666666665,
        2826.7430555555557,
        2826.7569444444443,
        2826.7708333333335,
        2826.784722222222,
        2826.7986111111113,
        2826.8125,
        2826.8263888888887,
        2826.840277777778,
        2826.8541666666665,
        2826.8680555555557,
        2826.8819444444443,
        2826.8958333333335,
        2826.909722222222,
        2826.9236111111113,
        2826.9375,
        2826.9513888888887,
        2826.965277777778,
        2826.9791666666665,
        2826.9930555555557,
        2827.0069444444443,
        2827.0208333333335,
        2827.034722222222,
        2827.0486111111113,
        2827.0625,
        2827.0763888888887,
        2827.090277777778,
        2827.1041666666665,
        2827.1180555555557,
        2827.1319444444443,
        2827.1458333333335,
        2827.159722222222,
        2827.1736111111113,
        2827.1875,
        2827.2013888888887,
        2827.215277777778,
        2827.2291666666665,
        2827.2430555555557,
        2827.2569444444443,
        2827.2708333333335,
        2827.284722222222,
        2827.2986111111113,
        2827.3125,
        2827.3263888888887,
        2827.340277777778,
        2827.3541666666665,
        2827.3680555555557,
        2827.3819444444443,
        2827.3958333333335,
        2827.409722222222,
        2827.4236111111113,
        2827.4375,
        2827.4513888888887,
        2827.465277777778,
        2827.4791666666665,
        2827.4930555555557,
        2827.5069444444443,
        2827.5208333333335,
        2827.534722222222,
        2827.5486111111113,
        2827.5625,
        2827.5763888888887,
        2827.590277777778,
        2827.6041666666665,
        2827.6180555555557,
        2827.6319444444443,
        2827.6458333333335,
        2827.659722222222,
        2827.6736111111113,
        2827.6875,
        2827.7013888888887,
        2827.715277777778,
        2827.7291666666665,
        2827.7430555555557,
        2827.7569444444443,
        2827.7708333333335,
        2827.784722222222,
        2827.7986111111113,
        2827.8125,
        2827.8263888888887,
        2827.840277777778,
        2827.8541666666665,
        2827.8680555555557,
        2827.8819444444443,
        2827.8958333333335,
        2827.909722222222,
        2827.9236111111113,
        2827.9375,
        2827.9513888888887,
        2827.965277777778,
        2827.9791666666665,
        2827.9930555555557,
        2828.0069444444443,
        2828.0208333333335,
        2828.034722222222,
        2828.0486111111113,
        2828.0625,
        2828.0763888888887,
        2828.090277777778,
        2828.1041666666665,
        2828.1180555555557,
        2828.1319444444443,
        2828.1458333333335,
        2828.159722222222,
        2828.1736111111113,
        2828.1875,
        2828.2013888888887,
        2828.215277777778,
        2828.2291666666665,
        2828.2430555555557,
        2828.2569444444443,
        2828.2708333333335,
        2828.284722222222,
        2828.2986111111113,
        2828.3125,
        2828.3263888888887,
        2828.340277777778,
        2828.3541666666665,
        2828.3680555555557,
        2828.3819444444443,
        2828.3958333333335,
        2828.409722222222,
        2828.4236111111113,
        2828.4375,
        2828.4513888888887,
        2828.465277777778,
        2828.4791666666665,
        2828.4930555555557,
        2828.5069444444443,
        2828.5208333333335,
        2828.534722222222,
        2828.5486111111113,
        2828.5625,
        2828.5763888888887,
        2828.590277777778,
        2828.6041666666665,
        2828.6180555555557,
        2828.6319444444443,
        2828.6458333333335,
        2828.659722222222,
        2828.6736111111113,
        2828.6875,
        2828.7013888888887,
        2828.715277777778,
        2828.7291666666665,
        2828.7430555555557,
        2828.7569444444443,
        2828.7708333333335,
        2828.784722222222,
        2828.7986111111113,
        2828.8125,
        2828.8263888888887,
        2828.840277777778,
        2828.8541666666665,
        2828.8680555555557,
        2828.8819444444443,
        2828.8958333333335,
        2828.909722222222,
        2828.9236111111113,
        2828.9375,
        2828.9513888888887,
        2828.965277777778,
        2828.9791666666665,
        2828.9930555555557,
        2829.0069444444443,
        2829.0208333333335,
        2829.034722222222,
        2829.0486111111113,
        2829.0625,
        2829.0763888888887,
        2829.090277777778,
        2829.1041666666665,
        2829.1180555555557,
        2829.1319444444443,
        2829.1458333333335,
        2829.159722222222,
        2829.1736111111113,
        2829.1875,
        2829.2013888888887,
        2829.215277777778,
        2829.2291666666665,
        2829.2430555555557,
        2829.2569444444443,
        2829.2708333333335,
        2829.284722222222,
        2829.2986111111113,
        2829.3125,
        2829.3263888888887,
        2829.340277777778,
        2829.3541666666665,
        2829.3680555555557,
        2829.3819444444443,
        2829.3958333333335,
        2829.409722222222,
        2829.4236111111113,
        2829.4375,
        2829.4513888888887,
        2829.465277777778,
        2829.4791666666665,
        2829.4930555555557,
        2829.5069444444443,
        2829.5208333333335,
        2829.534722222222,
        2829.5486111111113,
        2829.5625,
        2829.5763888888887,